{
  "$schema": "https://json-schema.org/draft/2020-12/schema",
  "$id": "https://example.local/schemas/document.schema.json",
  "title": "CraftCAD Document v2",
  "type": "object",
  "required": [
    "schema_version",
    "id",
    "units",
    "layers",
    "entities",
    "parts",
    "jobs"
  ],
  "additionalProperties": false,
  "properties": {
    "schema_version": {
      "type": "integer",
      "enum": [
        1,
        2
      ]
    },
    "id": {
      "$ref": "#/$defs/Uuid"
    },
    "units": {
      "type": "string",
      "enum": [
        "mm",
        "inch"
      ]
    },
    "layers": {
      "type": "array",
      "items": {
        "$ref": "#/$defs/Layer"
      }
    },
    "entities": {
      "type": "array",
      "items": {
        "$ref": "#/$defs/Entity"
      }
    },
    "parts": {
      "type": "array",
      "items": {
        "$ref": "#/$defs/Part"
      }
    },
    "jobs": {
      "type": "array",
      "items": {
        "$ref": "#/$defs/NestJob"
      }
    },
    "materials": {
      "type": "array",
      "items": {
        "$ref": "#/$defs/Material"
      },
      "default": []
    },
    "settings": {
      "$ref": "#/$defs/ProjectSettings"
    },
    "used_presets": {
      "type": "array",
      "items": {
        "$ref": "#/$defs/UsedPresetRef"
      },
      "default": []
    },
    "used_templates": {
      "type": "array",
      "items": {
        "$ref": "#/$defs/UsedTemplateRef"
      },
      "default": []
    },
    "wizard_runs": {
      "type": "array",
      "items": {
        "$ref": "#/$defs/WizardRunRecord"
      },
      "default": []
    }
  },
  "$defs": {
    "Uuid": {
      "type": "string",
      "pattern": "^[0-9a-fA-F]{8}-[0-9a-fA-F]{4}-[1-5][0-9a-fA-F]{3}-[89abAB][0-9a-fA-F]{3}-[0-9a-fA-F]{12}$"
    },
    "Vec2": {
      "type": "object",
      "required": [
        "x",
        "y"
      ],
      "additionalProperties": false,
      "properties": {
        "x": {
          "type": "number"
        },
        "y": {
          "type": "number"
        }
      }
    },
    "Style": {
      "type": "object",
      "description": "自由形式（将来の互換性のため additionalProperties=true）",
      "additionalProperties": true
    },
    "Layer": {
      "type": "object",
      "required": [
        "id",
        "name",
        "visible",
        "locked",
        "editable"
      ],
      "additionalProperties": false,
      "properties": {
        "id": {
          "$ref": "#/$defs/Uuid"
        },
        "name": {
          "type": "string",
          "minLength": 1
        },
        "visible": {
          "type": "boolean"
        },
        "locked": {
          "type": "boolean"
        },
        "editable": {
          "type": "boolean"
        }
      }
    },
    "Geom2D": {
      "oneOf": [
        {
          "$ref": "#/$defs/Line"
        },
        {
          "$ref": "#/$defs/Circle"
        },
        {
          "$ref": "#/$defs/Arc"
        },
        {
          "$ref": "#/$defs/Polyline"
        }
      ]
    },
    "Line": {
      "type": "object",
      "required": [
        "type",
        "a",
        "b"
      ],
      "additionalProperties": false,
      "properties": {
        "type": {
          "const": "Line"
        },
        "a": {
          "$ref": "#/$defs/Vec2"
        },
        "b": {
          "$ref": "#/$defs/Vec2"
        }
      }
    },
    "Circle": {
      "type": "object",
      "required": [
        "type",
        "c",
        "r"
      ],
      "additionalProperties": false,
      "properties": {
        "type": {
          "const": "Circle"
        },
        "c": {
          "$ref": "#/$defs/Vec2"
        },
        "r": {
          "type": "number",
          "exclusiveMinimum": 0
        }
      }
    },
    "Arc": {
      "type": "object",
      "required": [
        "type",
        "c",
        "r",
        "start_angle",
        "end_angle",
        "ccw"
      ],
      "additionalProperties": false,
      "properties": {
        "type": {
          "const": "Arc"
        },
        "c": {
          "$ref": "#/$defs/Vec2"
        },
        "r": {
          "type": "number",
          "exclusiveMinimum": 0
        },
        "start_angle": {
          "type": "number"
        },
        "end_angle": {
          "type": "number"
        },
        "ccw": {
          "type": "boolean"
        }
      }
    },
    "Polyline": {
      "type": "object",
      "required": [
        "type",
        "pts",
        "closed"
      ],
      "additionalProperties": false,
      "properties": {
        "type": {
          "const": "Polyline"
        },
        "pts": {
          "type": "array",
          "minItems": 2,
          "items": {
            "$ref": "#/$defs/Vec2"
          }
        },
        "closed": {
          "type": "boolean"
        }
      }
    },
    "Entity": {
      "type": "object",
      "required": [
        "id",
        "layer_id",
        "geom",
        "style",
        "tags",
        "meta"
      ],
      "additionalProperties": false,
      "properties": {
        "id": {
          "$ref": "#/$defs/Uuid"
        },
        "layer_id": {
          "$ref": "#/$defs/Uuid"
        },
        "geom": {
          "$ref": "#/$defs/Geom2D"
        },
        "style": {
          "$ref": "#/$defs/Style"
        },
        "tags": {
          "type": "array",
          "items": {
            "type": "string"
          }
        },
        "meta": {
          "type": "object",
          "additionalProperties": true
        }
      }
    },
    "Polygon2D": {
      "type": "object",
      "required": [
        "outer",
        "holes"
      ],
      "additionalProperties": false,
      "properties": {
        "outer": {
          "type": "array",
          "minItems": 3,
          "items": {
            "$ref": "#/$defs/Vec2"
          }
        },
        "holes": {
          "type": "array",
          "items": {
            "type": "array",
            "minItems": 3,
            "items": {
              "$ref": "#/$defs/Vec2"
            }
          }
        }
      }
    },
    "Part": {
      "type": "object",
      "required": [
        "id",
        "name",
        "outline",
        "thickness",
        "quantity",
        "material_id",
        "grain_dir",
        "allow_rotate",
        "margin",
        "kerf"
      ],
      "additionalProperties": false,
      "properties": {
        "id": {
          "$ref": "#/$defs/Uuid"
        },
        "name": {
          "type": "string",
          "minLength": 1
        },
        "outline": {
          "$ref": "#/$defs/Polygon2D"
        },
        "thickness": {
          "type": "number",
          "minimum": 0
        },
        "quantity": {
          "type": "integer",
          "minimum": 1
        },
        "material_id": {
          "$ref": "#/$defs/Uuid"
        },
        "grain_dir": {
          "type": [
            "number",
            "null"
          ]
        },
        "allow_rotate": {
          "type": "boolean"
        },
        "margin": {
          "type": "number",
          "minimum": 0
        },
        "kerf": {
          "type": "number",
          "minimum": 0
        }
      }
    },
    "SheetDef": {
      "type": "object",
      "required": [
        "id",
        "material_id",
        "width",
        "height",
        "quantity"
      ],
      "additionalProperties": false,
      "properties": {
        "id": {
          "$ref": "#/$defs/Uuid"
        },
        "material_id": {
          "$ref": "#/$defs/Uuid"
        },
        "width": {
          "type": "number",
          "exclusiveMinimum": 0
        },
        "height": {
          "type": "number",
          "exclusiveMinimum": 0
        },
        "quantity": {
          "type": "integer",
          "minimum": 1
        }
      }
    },
    "NestConstraints": {
      "type": "object",
      "required": [
        "global_margin",
        "global_kerf",
        "allow_rotate_default"
      ],
      "additionalProperties": false,
      "properties": {
        "global_margin": {
          "type": "number",
          "minimum": 0
        },
        "global_kerf": {
          "type": "number",
          "minimum": 0
        },
        "allow_rotate_default": {
          "type": "boolean"
        },
        "no_go_zones": {
          "type": "array",
          "items": {
            "$ref": "#/$defs/NoGoZone"
          }
        },
        "grain_policy": {
          "type": "string",
          "enum": [
            "Strict",
            "Prefer",
            "Ignore"
          ]
        }
      }
    },
    "PartRef": {
      "type": "object",
      "required": [
        "part_id"
      ],
      "additionalProperties": false,
      "properties": {
        "part_id": {
          "$ref": "#/$defs/Uuid"
        },
        "quantity_override": {
          "type": [
            "integer",
            "null"
          ],
          "minimum": 1
        }
      }
    },
    "NoGoZone": {
      "type": "object",
      "required": [
        "type",
        "x",
        "y",
        "width",
        "height"
      ],
      "additionalProperties": false,
      "properties": {
        "type": {
          "const": "Rect"
        },
        "x": {
          "type": "number"
        },
        "y": {
          "type": "number"
        },
        "width": {
          "type": "number",
          "exclusiveMinimum": 0
        },
        "height": {
          "type": "number",
          "exclusiveMinimum": 0
        }
      }
    },
    "NestObjective": {
      "type": "object",
      "required": [
        "w_utilization",
        "w_sheet_count",
        "w_cut_count"
      ],
      "additionalProperties": false,
      "properties": {
        "w_utilization": {
          "type": "number"
        },
        "w_sheet_count": {
          "type": "number"
        },
        "w_cut_count": {
          "type": "number"
        }
      }
    },
    "NestResult": {
      "type": "object",
      "description": "v1では自由形式（将来の互換のため）",
      "additionalProperties": true
    },
    "NestTrace": {
      "type": "object",
      "description": "v1では自由形式（将来の互換のため）",
      "additionalProperties": true
    },
    "NestJob": {
      "type": "object",
      "required": [
        "id",
        "sheet_defs",
        "parts_ref",
        "constraints",
        "objective",
        "seed",
        "result",
        "trace"
      ],
      "additionalProperties": false,
      "properties": {
        "id": {
          "$ref": "#/$defs/Uuid"
        },
        "sheet_defs": {
          "type": "array",
          "items": {
            "$ref": "#/$defs/SheetDef"
          }
        },
        "parts_ref": {
          "type": "array",
          "items": {
            "anyOf": [
              {
                "$ref": "#/$defs/Uuid"
              },
              {
                "$ref": "#/$defs/PartRef"
              }
            ]
          }
        },
        "constraints": {
          "$ref": "#/$defs/NestConstraints"
        },
        "objective": {
          "$ref": "#/$defs/NestObjective"
        },
        "seed": {
          "type": "integer",
          "minimum": 0
        },
        "result": {
          "anyOf": [
            {
              "$ref": "#/$defs/NestResult"
            },
            {
              "type": "null"
            }
          ]
        },
        "trace": {
          "anyOf": [
            {
              "$ref": "#/$defs/NestTrace"
            },
            {
              "type": "null"
            }
          ]
        }
      }
    },
    "MaterialCategory": {
      "type": "string",
      "enum": [
        "wood",
        "leather",
        "other"
      ]
    },
    "SheetDefault": {
      "type": "object",
      "required": [
        "width",
        "height",
        "quantity"
      ],
      "additionalProperties": false,
      "properties": {
        "width": {
          "type": "number",
          "exclusiveMinimum": 0
        },
        "height": {
          "type": "number",
          "exclusiveMinimum": 0
        },
        "quantity": {
          "type": "integer",
          "minimum": 1
        }
      }
    },
    "Material": {
      "type": "object",
      "required": [
        "id",
        "name",
        "category",
        "thickness_mm"
      ],
      "additionalProperties": false,
      "properties": {
        "id": {
          "$ref": "#/$defs/Uuid"
        },
        "name": {
          "type": "string",
          "minLength": 1
        },
        "category": {
          "$ref": "#/$defs/MaterialCategory"
        },
        "thickness_mm": {
          "type": [
            "number",
            "null"
          ]
        },
        "sheet_default": {
          "anyOf": [
            {
              "$ref": "#/$defs/SheetDefault"
            },
            {
              "type": "null"
            }
          ]
        },
        "notes": {
          "type": "string"
        }
      }
    },
    "ProjectSettings": {
      "type": "object",
      "additionalProperties": false,
      "properties": {
        "bom_delimiter": {
          "type": [
            "string",
            "null"
          ]
        }
      }
    },
    "UsedPresetRef": {
      "type": "object",
      "required": [
        "kind",
        "id",
        "version"
      ],
      "additionalProperties": false,
      "properties": {
        "kind": {
          "type": "string",
          "enum": [
            "material",
            "process",
            "output",
            "hardware"
          ]
        },
        "id": {
          "type": "string",
          "minLength": 1
        },
        "version": {
          "type": "string",
          "minLength": 1
        }
      }
    },
    "UsedTemplateRef": {
      "type": "object",
      "required": [
        "id",
        "version"
      ],
      "additionalProperties": false,
      "properties": {
        "id": {
          "type": "string",
          "minLength": 1
        },
        "version": {
          "type": "string",
          "minLength": 1
        }
      }
    },
    "WizardRunRecord": {
      "type": "object",
      "required": [
        "run_id",
        "template_id",
        "template_version",
        "inputs_hash",
        "seed",
        "outputs_part_ids",
        "created_at_unix_ms"
      ],
      "additionalProperties": false,
      "properties": {
        "run_id": {
          "type": "string",
          "minLength": 1
        },
        "template_id": {
          "type": "string",
          "minLength": 1
        },
        "template_version": {
          "type": "string",
          "minLength": 1
        },
        "inputs_hash": {
          "type": "string",
          "pattern": "^[0-9a-f]{64}$"
        },
        "seed": {
          "type": "integer",
          "minimum": 0
        },
        "outputs_part_ids": {
          "type": "array",
          "items": {
            "$ref": "#/$defs/Uuid"
          }
        },
        "created_at_unix_ms": {
          "type": "integer"
        }
      }
    }
  }
}
